{
  "schema": "astromark/1.0",
  "profile": "astromark/lens/1.0",
  "system": {
    "verdict": "likely_lens",
    "grade": "A",
    "p_lens": 0.92,
    "counter_image": "core:found",
    "n_images": 2,
    "description": "Red early-type deflector crossed by a dust lane, with a blue tangential arc at 1.45 arcsec and a counter-image at 1.72 arcsec on the opposite side. A second deflector and a bound satellite add mass. The spiral to the north-west has an arm that mimics an arc; its curvature is centred on its own bulge.",
    "hard_case": [
      "lens:dust_lane_case",
      "lens:second_deflector_case",
      "lens:counter_image_outside_arc"
    ],
    "theta_e": {
      "value_arcsec": 1.45,
      "lower_arcsec": 1.15,
      "upper_arcsec": 1.8,
      "method": "lens:arc_midline"
    },
    "sources": [
      {
        "tag": "S1",
        "n_images": 2,
        "config": "lens:double"
      }
    ]
  },
  "marks": [
    {
      "id": "m-defl",
      "type": "vector",
      "role": "lens:deflector",
      "polarity": "core:positive",
      "tail": [
        0.5,
        0.35
      ],
      "head": [
        0.5,
        0.51
      ],
      "label": "deflector",
      "emphasis": "core:normal"
    },
    {
      "id": "m-dust",
      "type": "vector",
      "role": "lens:dust_lane",
      "polarity": "core:positive",
      "tail": [
        0.6243,
        0.3495
      ],
      "head": [
        0.5304,
        0.5261
      ],
      "label": "dust lane"
    },
    {
      "id": "m-defl2",
      "type": "vector",
      "role": "lens:second_deflector",
      "polarity": "core:positive",
      "tail": [
        0.235,
        0.6567
      ],
      "head": [
        0.3531,
        0.5913
      ],
      "label": "second deflector"
    },
    {
      "id": "m-sat",
      "type": "vector",
      "role": "lens:satellite",
      "polarity": "core:positive",
      "tail": [
        0.2436,
        0.4601
      ],
      "head": [
        0.3761,
        0.4859
      ],
      "label": "satellite"
    },
    {
      "id": "m-arc",
      "type": "vector",
      "role": "lens:arc",
      "polarity": "core:positive",
      "tail": [
        0.3942,
        0.7092
      ],
      "head": [
        0.4575,
        0.59
      ],
      "source": "S1",
      "label": "arc"
    },
    {
      "id": "m-knot",
      "type": "vector",
      "role": "lens:knot",
      "polarity": "core:positive",
      "tail": [
        0.48,
        0.6995
      ],
      "head": [
        0.4905,
        0.6001
      ],
      "source": "S1",
      "label": "knot"
    },
    {
      "id": "m-ci",
      "type": "vector",
      "role": "lens:counter_image",
      "polarity": "core:positive",
      "tail": [
        0.6139,
        0.2959
      ],
      "head": [
        0.5505,
        0.4151
      ],
      "source": "S1",
      "label": "counter-image",
      "emphasis": "core:key"
    },
    {
      "id": "m-mimic",
      "type": "vector",
      "role": "lens:arc",
      "polarity": "core:negative",
      "tail": [
        0.8507,
        0.3583
      ],
      "head": [
        0.7394,
        0.2819
      ],
      "alternative": "lens:spiral_arm",
      "label": "arc"
    },
    {
      "id": "m-ring",
      "type": "circle",
      "role": "lens:einstein_ring",
      "center_ref": "m-defl",
      "radius_arcsec": 1.45,
      "source": "S1",
      "bound": "nominal",
      "lower_arcsec": 1.15,
      "upper_arcsec": 1.8,
      "method": "lens:arc_midline"
    },
    {
      "id": "m-ring-lo",
      "type": "circle",
      "role": "lens:einstein_ring",
      "center_ref": "m-defl",
      "radius_arcsec": 1.15,
      "source": "S1",
      "bound": "lower"
    },
    {
      "id": "m-ring-hi",
      "type": "circle",
      "role": "lens:einstein_ring",
      "center_ref": "m-defl",
      "radius_arcsec": 1.8,
      "source": "S1",
      "bound": "upper"
    },
    {
      "id": "m-mask-1",
      "type": "circle",
      "role": "lens:field_galaxy",
      "center": [
        0.1813,
        0.2413
      ],
      "radius_arcsec": 1.1,
      "treatment": "core:mask"
    },
    {
      "id": "m-mask-2",
      "type": "circle",
      "role": "lens:field_galaxy",
      "center": [
        0.85,
        0.7944
      ],
      "radius_arcsec": 0.94,
      "treatment": "core:mask"
    },
    {
      "id": "m-mask-3",
      "type": "circle",
      "role": "lens:field_galaxy",
      "center": [
        0.2469,
        0.8444
      ],
      "radius_arcsec": 0.78,
      "treatment": "core:mask"
    },
    {
      "id": "m-mask-4",
      "type": "circle",
      "role": "lens:field_galaxy",
      "center": [
        0.5687,
        0.8912
      ],
      "radius_arcsec": 0.68,
      "treatment": "core:mask"
    },
    {
      "id": "m-mask-near",
      "type": "circle",
      "role": "lens:field_galaxy",
      "center": [
        0.3094,
        0.3444
      ],
      "radius_arcsec": 1.15,
      "label": "nearby galaxy",
      "treatment": "core:model"
    },
    {
      "id": "m-mask-star",
      "type": "circle",
      "role": "lens:star",
      "center": [
        0.7125,
        0.6381
      ],
      "radius_arcsec": 0.55,
      "treatment": "core:mask"
    },
    {
      "id": "m-seg-lens",
      "type": "polygon",
      "role": "lens:lens_light",
      "polarity": "core:positive",
      "points": [
        [
          0.5579,
          0.5408
        ],
        [
          0.5517,
          0.5491
        ],
        [
          0.5428,
          0.5555
        ],
        [
          0.5318,
          0.5595
        ],
        [
          0.5192,
          0.5611
        ],
        [
          0.5056,
          0.5602
        ],
        [
          0.4917,
          0.5567
        ],
        [
          0.4783,
          0.5508
        ],
        [
          0.4659,
          0.543
        ],
        [
          0.4553,
          0.5334
        ],
        [
          0.4469,
          0.5227
        ],
        [
          0.4412,
          0.5114
        ],
        [
          0.4384,
          0.5
        ],
        [
          0.4387,
          0.4891
        ],
        [
          0.4421,
          0.4792
        ],
        [
          0.4483,
          0.4709
        ],
        [
          0.4572,
          0.4645
        ],
        [
          0.4682,
          0.4605
        ],
        [
          0.4808,
          0.4589
        ],
        [
          0.4944,
          0.4598
        ],
        [
          0.5083,
          0.4633
        ],
        [
          0.5217,
          0.4692
        ],
        [
          0.5341,
          0.477
        ],
        [
          0.5447,
          0.4866
        ],
        [
          0.5531,
          0.4973
        ],
        [
          0.5588,
          0.5086
        ],
        [
          0.5616,
          0.52
        ],
        [
          0.5613,
          0.5309
        ]
      ]
    },
    {
      "id": "m-seg-arc",
      "type": "polygon",
      "role": "lens:lensed_light",
      "polarity": "core:positive",
      "points": [
        [
          0.5519,
          0.5999
        ],
        [
          0.5393,
          0.606
        ],
        [
          0.526,
          0.6104
        ],
        [
          0.5123,
          0.613
        ],
        [
          0.4983,
          0.6137
        ],
        [
          0.4844,
          0.6126
        ],
        [
          0.4707,
          0.6095
        ],
        [
          0.4576,
          0.6047
        ],
        [
          0.4452,
          0.5981
        ],
        [
          0.4339,
          0.5899
        ],
        [
          0.4237,
          0.5803
        ],
        [
          0.4149,
          0.5694
        ],
        [
          0.4077,
          0.5574
        ],
        [
          0.4022,
          0.5446
        ],
        [
          0.3984,
          0.5311
        ],
        [
          0.3965,
          0.5172
        ],
        [
          0.4227,
          0.5154
        ],
        [
          0.4241,
          0.5258
        ],
        [
          0.4269,
          0.5358
        ],
        [
          0.4311,
          0.5454
        ],
        [
          0.4365,
          0.5544
        ],
        [
          0.443,
          0.5625
        ],
        [
          0.4506,
          0.5697
        ],
        [
          0.4591,
          0.5758
        ],
        [
          0.4683,
          0.5807
        ],
        [
          0.4781,
          0.5843
        ],
        [
          0.4883,
          0.5866
        ],
        [
          0.4987,
          0.5875
        ],
        [
          0.5092,
          0.587
        ],
        [
          0.5194,
          0.585
        ],
        [
          0.5294,
          0.5817
        ],
        [
          0.5388,
          0.5771
        ]
      ],
      "source": "S1"
    },
    {
      "id": "m-seg-ci",
      "type": "polygon",
      "role": "lens:lensed_light",
      "polarity": "core:positive",
      "points": [
        [
          0.5693,
          0.4251
        ],
        [
          0.5674,
          0.4275
        ],
        [
          0.5646,
          0.4294
        ],
        [
          0.5611,
          0.4305
        ],
        [
          0.5572,
          0.4308
        ],
        [
          0.5528,
          0.4304
        ],
        [
          0.5484,
          0.4292
        ],
        [
          0.544,
          0.4272
        ],
        [
          0.54,
          0.4247
        ],
        [
          0.5365,
          0.4217
        ],
        [
          0.5338,
          0.4184
        ],
        [
          0.5318,
          0.4149
        ],
        [
          0.5308,
          0.4114
        ],
        [
          0.5308,
          0.4081
        ],
        [
          0.5317,
          0.4051
        ],
        [
          0.5336,
          0.4027
        ],
        [
          0.5364,
          0.4008
        ],
        [